owner, heightaboveaverageterrain, licensee, city, broadcastarea, broadcaststationclass, sisterstation
country, education-inv, motto, officialschoolcolour
campustype, location, type, rival
party-inv, country, europeanparliamentgroup, otherparty-inv
currentstatus, language, location, regionserved
country, recordlabel-inv, parentcompany, location, homepage
schoolpatron, name, type
headlabel, country, gender, lowerage, significantproject-inv, type
digitalsubchannel, broadcastnetwork, country, formerbroadcastnetwork, broadcaststationclass, locationcountry, formerchannel, digitalchannel
city, broadcastarea, effectiveradiatedpower, language, programmeformat
country, militarybranch-inv, role, garrison
owner, nick, managerclub-inv, team-inv, ground, homepage
aircraftattack, aircraftfighter, aircraftrecon, type, aircrafttrainer, aircrafttransport
keyperson, revenue, assets, industry, locationcountry, foundingyear, numberofemployees, type, netincome
licensee, formerbroadcastnetwork, effectiveradiatedpower, alias, formerchannel, owningcompany, callsignmeaning
city, managerclub-inv, coachedteam-inv
keyperson, industry, board-inv
campustype, foundingyear, grades, state, type, religion
owner, industry, locationcountry, locationcity, equity, owningcompany
battle, aircraftfighter, aircraftrecon, type, aircrafttrainer, aircrafttransport
motto, type, slogan, officialschoolcolour, denomination
publisher-inv, knownfor-inv, parentcompany, distributor-inv
country, commander, role, aircraftrecon, secondcommander, militarybranch, identificationsymbol, commandstructure
city, postalcode, district, authority, county, type
nick, league, name, season, ground, position, capacity
country, ispartof, type
country, numberofundergraduatestudents, type, coachedteam-inv
product, industry, internationally, numberofemployees, type, foundationplace
owner, parentcompany, foundingyear, foundationplace, owningcompany
country, city, county, lowerage, foundingyear, upperage, type, foundedby
affiliation, education-inv, motto, almamater-inv, type, athletics, coachedteam-inv
operatingsystem-inv, type
country, city, postalcode, state, type, rival-inv, rival
board-inv, type, foundationplace
lastelectiondate, numberofmembers, politicalpartyofleader, politicalpartyinlegislature, type
battle, country, commander, garrison, militaryunitsize, type, activeyearsendyear, commandstructure
country, upperage, type, school-inv, religion
name, callsign, otherchannel
hometown, activeyearsstartyear, background, notablework-inv, genre
country, recordlabel-inv, parentcompany, location, foundingyear
digitalsubchannel, country, formerbroadcastnetwork, effectiveradiatedpower, location, locationcountry, formerchannel
country, averageclasssize, grades, type, status
network-inv, country, keyperson, locationcountry, owningcompany, pictureformat
country, formationyear, europeanparliamentgroup, ideology, europeanaffiliation, internationalaffiliation
country, garrison, motto, anniversary, commandstructure
publisher-inv, fate, industry, locationcountry
owningorganisation-inv, rdf-schema#seealso-inv, owner-inv
country, affiliation, campus, state, type, athletics, employer-inv
country, garrison, militarybranch, aircraftbomber
country, profession-inv, affiliation, education-inv, almamater-inv, state, athletics, coachedteam-inv
nick, battle, country, rdf-schema#seealso, militarybranch, type
country, city, state, type, athletics, coachedteam-inv
country, location, locationcountry, digitalchannel, otherchannel
broadcastnetwork, country, formerbroadcastnetwork, location, locationcountry, formerchannel, locationcity, sisterstation
broadcastnetwork, country, channel-inv, licensee, formerbroadcastnetwork, locationcountry, formerchannel, owningcompany
owner, industry, internationally, owningcompany, manufacturer-inv
headlabel, country, lowerage, staff, upperage, type, religion
keyperson, product, parentcompany, industry, locationcountry, type, locationcity
owner, league, foundingyear
associatedmusicalartist-inv, hometown, associatedmusicalartist, background, associatedband, instrument, associatedband-inv
product, recordlabel-inv, industry, location
foundingdate, affiliation, type
country, activeyearsstartyear, militarybranch, motto, battlehonours, militaryunit-inv, activeyearsendyear
campussize, gender
numberofstudents, chancellor, province, mascot, affiliation, motto, type, officialschoolcolour
province, city, district, homepage
location, grades, state, type, religion
rdf-schema#seealso, managerclub-inv, team-inv, title, chairmantitle
formerteam-inv, league-inv, team, tenant-inv
activeyearsstartyear, background, genre, alias, formerbandmember, activeyearsendyear, homepage
country, city, district, grades, state, type, status
education-inv, almamater-inv, rdf-schema#seealso-inv, training-inv, employer-inv
broadcastnetwork, country, formerbroadcastnetwork, location, locationcountry, formerchannel, otherchannel, slogan, employer-inv, sisterstation, homepage
country, licensee, formerbroadcastnetwork, location, locationcountry, formerchannel, owningcompany, employer-inv, sisterstation
sharesource, broadcaststationclass, callsignmeaning
numberofstudents, province, city, schoolboard, language, type
facultysize, country, campustype, foundingyear, state, type
trainer-inv
recordlabel-inv, parentcompany, industry
gender, city, postalcode, campustype, state, status
gender, campustype, sport, agerange
country, aircraftfighter, militarybranch, aircraftelectronic, identificationsymbol
broadcastnetwork, city, alias, language, programmeformat, slogan, homepage
commander, identificationsymbol, aircrafttrainer
country, occupation, activeyearsstartyear, genre
country, sharesource, locationcountry, slogan, pictureformat
city, county, motto, grades, state
country, garrison, rdf-schema#seealso-inv, type
city, board-inv
headlabel, country, state, numberofgraduatestudents
owner, product, parentcompany, industry, locationcountry, locationcity, owningcompany
numberofpostgraduatestudents, country, province, numberofundergraduatestudents, city, affiliation
division, keyperson, locationcity
country, formerbroadcastnetwork, locationcountry, analogchannel
network-inv, channel-inv, sharesource, owningcompany, sisterstation
team-inv, education-inv, almamater-inv, state, type, athletics, college-inv
teachingstaff, state, homepage
owner, parentcompany, industry, internationally, location, owningcompany
country, militarybranch, name, rdf-schema#seealso-inv, type
numberofstudents, country, county, lowerage, upperage, type, religion
network-inv, notablework-inv, tenant-inv, manufacturer-inv, employer-inv
numberofstudents, tuition, grades, state, type, religion
politicalpartyofleader-inv, politicalpartyinlegislature-inv
headlabel, country, education-inv, lowerage, upperage, type
rdf-schema#seealso-inv, coachedteam-inv
country, localauthority, city, lowerage, staff, upperage, type, religion
country, gender, foundingyear, sport, status
broadcastnetwork, country, language, locationcountry, predecessor, slogan, owningcompany, sisterstation
battle, country, activeyearsstartyear, militarybranch, militaryunitsize, disbanded, type, activeyearsendyear
keyperson, subsidiary, manufacturer-inv, employer-inv
country, formerbroadcastnetwork, effectiveradiatedpower, location, locationcountry, formerchannel, otherchannel, employer-inv
product, rdf-schema#seealso, cpu-inv, computingplatform-inv, type, locationcity
affiliation-inv, headquarter, regionserved
formerteam-inv, league, location, foundingyear, tenant-inv
activeyearsstartyear, knownfor-inv, identificationsymbol
motto, owningcompany
keyperson, product, industry, type, foundedby, locationcity, foundationplace
keyperson, product, developer-inv, industry, internationally, type
formationyear, purpose, affiliation, location
country, genre, location, foundingyear, occupation-inv
country, city, affiliation, motto, endowment, state, type, president
country, gender, motto, grades, type, religion
facultysize, foundingyear, grades, type, religion, ratio
owner, knownfor-inv, nonfictionsubject-inv, location, type, foundedby, owningcompany
license-inv
country, campus, education-inv, almamater-inv, state, type, athletics, coachedteam-inv
headlabel, gender, district, grades, state, type, rival
country, gender, grades, agerange
city, grades, state, type, coachedteam-inv, religion
league, managertitle, formationdate, chairmantitle
grades, state, type, religion, ratio, status
architecturalstyle, yearofconstruction
activeyearsstartyear, garrison, militaryunitsize, commandstructure, march
nick, country, role, activeyearsstartyear, name, motto, militaryunitsize, identificationsymbol, battlehonours
purpose, affiliation, membership, status
headlabel, country, specialist, lowerage, staff, type
head, country, award-inv, almamater-inv, type
type, aircraftpatrol
ispartof, location, sistercollege
parentcompany, operator-inv, regionserved
mascot, state, type, coachedteam-inv
numberofstudents, country, location, state
country, gender, city, postalcode, county, motto, lowerage, foundingyear, upperage, foundedby, homepage
city, postalcode, district, county, grades, state, type, homepage
award-inv, foundingyear, locationcity
city, county, closed, grades, state, type, homepage, status
battle, country, role, aircraftfighter, activeyearsstartyear, militarybranch, aircraftelectronic, aircrafthelicopter, type, commandstructure, aircrafttransport
owner, keyperson, product, industry, internationally, location, type, owningcompany
knownfor-inv, managerclub-inv, team-inv, tenant-inv
publisher-inv, keyperson, manufacturer-inv
foundingyear, operator-inv, locationcity
country, affiliation, designer-inv, almamater-inv, type, athletics
hometown, activeyearsstartyear, genre, instrument, producer-inv
product, industry, locationcity, foundationplace, subsidiary
birthplace-inv, territory-inv
affiliation-inv, city, affiliation, education-inv, institution-inv, almamater-inv, state, type, athletics, author-inv
city, broadcastarea, formercallsign, slogan
gender, foundingyear, type, slogan
broadcastnetwork, name, callsign, broadcaststationclass, digitalchannel, owningcompany
fate, industry, internationally, type
owner, keyperson, parentcompany, industry, subsidiary-inv, locationcity, owningcompany
ground, tenant-inv, coach
broadcastnetwork, country, effectiveradiatedpower, alias, locationcountry, formerchannel, slogan, owningcompany, callsignmeaning, homepage
operatingsystem-inv, foundingyear
bandmember, occupation, background, genre, formerbandmember
formationyear, purpose, language, status
type-inv, owner, headquarter, location, operatedby, map, homepage
city, league, tenant-inv, coachedteam-inv
hometown, composer-inv, associatedmusicalartist, background, associatedband
battle, country, militarybranch, type, activeyearsendyear, notablecommander
country, channel-inv, formerbroadcastnetwork-inv, locationcountry, type, pictureformat
owner, industry, numberofemployees, type, owl#differentfrom, owningcompany
owner, company-inv, successor, parentcompany, industry, location, type, owningcompany
broadcastnetwork, country, headquarter, language, locationcountry, slogan, owningcompany, pictureformat
principal, country, city, campus, motto, state, type
country, mascot, foundingyear, agerange, status
colour, officialschoolcolour, religion
formerbroadcastnetwork, broadcaststationclass, formationdate
country, gender, city, district, campustype, state, type, homepage
country, schoolboard, foundingyear, type, status
network-inv, country, locationcountry, type, digitalchannel, analogchannel, pictureformat
country, affiliation, campus, athletics, president
party-inv, headquarter, homepage
product, industry, internationally, extinctionyear
formationyear, headquarter, extinctiondate, location, extinctionyear, formationdate
country, gender, language, foundingyear, type, status
battle, country, activeyearsstartyear, militaryunitsize, disbanded, battlehonours, activeyearsendyear
country, colourname, garrison, militarybranch, aircraftpatrol
keyperson, internationally, type, builder-inv
country, effectiveradiatedpower, location, locationcountry, formerchannel, locationcity, callsignmeaning
party-inv, country, headquarter, otherparty-inv, ideology, nationalaffiliation
genre, description
headlabel, name, location
recordlabel-inv, knownfor-inv, distributor-inv
country, licensee, formerbroadcastnetwork, effectiveradiatedpower, locationcountry, formerchannel, slogan, owningcompany, sisterstation
broadcastnetwork, country, firstairdate, locationcountry, formercallsign
successor, extinctiondate, service, industry, locationcountry, extinctionyear, foundingyear
leader, colour, ideology, europeanaffiliation, internationalaffiliation
country, identificationsymbol, aircraftbomber, aircrafttransport
broadcastnetwork, webcast, licensee, city, broadcaststationclass, programmeformat, sisterstation, homepage
owner, keyperson, location, foundingyear, type, owningcompany
country, affiliation, campus, managerclub-inv, type, athletics
birthyear
product, industry, locationcountry, type, locationcity, homepage, regionserved
currentstatus, industry, distributor-inv
nick, name, team-inv, managertitle, chairman, ground, homepage
recordlabel-inv, distributingcompany, parentcompany, distributinglabel, foundedby, occupation-inv
nick, country, city, mascot, postalcode, state
country, commander, activeyearsstartyear, secondcommander, motto, type, identificationsymbol, commandstructure, homepage
name, chairman, tenant-inv
country, campus, award-inv, education-inv, almamater-inv, athletics
numberofstudents, country, language, foundingyear, type
country, artist-inv, activeyearsstartyear, genre
rdf-schema#seealso, formerteam-inv, team-inv, board-inv, tenant-inv
broadcastnetwork, country, licensee, formerbroadcastnetwork, name, callsign, alias, locationcountry, slogan, owningcompany, sisterstation, homepage
country, publisher-inv, developer-inv
childorganisation, headquarter, location
campus, almamater-inv, state, type, college-inv
product, parentcompany, industry, locationcity, homepage
fate, locationcountry, extinctionyear, homepage
internationally, operatedby-inv, locationcity
owner, broadcastnetwork, sisterstation-inv, city, broadcastarea, broadcaststationclass, sisterstation
parentorganisation, rdf-schema#seealso, purpose, headquarter, type, status
headquarter, language, membership, type, status
country, schoolpatron, city, classes, type
colour, foundingyear, officialschoolcolour
battle, militarybranch-inv, motto, type, aircrafttrainer, aircrafttransport
owner, league, managerclub-inv, team-inv, season, tenant-inv
broadcastnetwork, sisterstation-inv, city, programmeformat, sisterstation, homepage
party-inv, europeanparliamentgroup, name, ideology, europeanaffiliation, internationalaffiliation
currentstatus, language, numberofemployees, regionserved
product, parentcompany, industry, type, manufacturer-inv
director, university, stadium
nick, battle, country, role, militarybranch, aircraftelectronic
nick, country, foundingyear, ratio
gender, campustype, foundingyear, grades, type, religion
country, name, motto, location, state, homepage, teamname
country, role, activeyearsstartyear, commander-inv, type, commandstructure
network-inv, broadcastnetwork, creator-inv, channel-inv, shareofaudience, sharesource, language, pictureformat
gender, averageclasssize, motto, grades, type, ratio, teamname
numberofstudents, headlabel, province, city, language, type
country, service, numberoflocations, genre, industry, internationally, location, locationcountry, type, locationcity, regionserved
numberofstudents, city, state, school-inv
lastelectiondate, electiondateleader, type, house
country, firstpublicationyear
battle, country, activeyearsstartyear, garrison, motto, identificationsymbol, militaryunit-inv, activeyearsendyear, notablecommander
mainorgan, headquarter, regionserved
nick, team-inv, ground, tenant-inv, formationdate, capacity
city, county, state, type, rival, slogan
colour, province, city, lowerage, upperage, type
country, gender, foundingyear, state, status
country, formerbroadcastnetwork, alias, broadcaststationclass, location, locationcountry, formerchannel, owningcompany
country, city, state, religion, teamname
keyperson, rdf-schema#seealso-inv, manufacturer-inv
country, city, affiliation, district, state, type
militarybranch, battlehonours, commandstructure, aircraftbomber
leader, headquarter, jurisdiction, name, location, type
owner, webcast, sharesource, broadcaststationclass, homepage
broadcastnetwork, broadcaststationclass, owningcompany, callsignmeaning
country, address, city, postalcode, sport
internationally, locationcountry, extinctionyear, locationcity
owner, broadcastnetwork, webcast, broadcastarea, alias, slogan, sisterstation
owner, licensee, city, broadcastarea, alias, broadcaststationclass, callsignmeaning, homepage
country, militarybranch-inv, garrison, secondcommander, motto, rdf-schema#seealso-inv, identificationsymbol, employer-inv
digitalsubchannel, formerbroadcastnetwork, alias, broadcaststationclass, digitalchannel
broadcastnetwork, city, sharesource, broadcaststationclass, programmeformat
country, grades, state, type, religion, ratio, teamname
leadertitle, utcoffset
country, affiliation, field-inv, almamater-inv, type, athletics
alliance, headquarter, targetairport, parentcompany, industry, homepage
city, broadcastarea, sharesource, language
license, frequentlyupdated, status
recordlabel-inv, industry, locationcountry, foundedby
broadcastnetwork, city, name, programmeformat, slogan, callsignmeaning, homepage
keyperson, location, foundingyear, numberofemployees, type, regionserved
country, militarybranch-inv, commander, commander-inv, motto, rdf-schema#seealso-inv, owner-inv, identificationsymbol, activeyearsendyear
head, gender, grades, type, religion
keyperson, currentstatus, locationcountry
country, sisterstation-inv, channel-inv, locationcountry, slogan, owningcompany, sisterstation
nick, battle, country, garrison, militarybranch, militaryunit-inv, commandstructure
country, affiliation, almamater-inv, type, athletics, officialschoolcolour
country, city, affiliation, almamater-inv, state, athletics, coachedteam-inv, college-inv
battle, country, garrison, militarybranch, aircraftelectronic, type
owner, product, parentcompany, industry, location, foundingyear, owningcompany
nick, battle, country, aircraftattack, colour, garrison, militarybranch, commandstructure
knownfor-inv, background, genre, formerbandmember
facultysize, city, foundingyear, grades, state, type
product, industry, location, operatedby-inv, employer-inv
owner, servingrailwayline-inv, headquarter, location
country, city, postalcode, county, lowerage, upperage, religion
aircraftattack, aircraftfighter, identificationsymbol, aircraftinterceptor, aircrafttrainer, aircrafttransport
league, team-inv, season, ground, honours, position
formerteam-inv, affiliation, campus, athletics
city, postalcode, motto, language, state
country, city, postalcode, county, type, foundedby, religion
owningorganisation-inv, operatedby-inv, foundingyear, operator-inv, owner-inv
affiliation-inv, location
numberofstudents, motto, state, type, religion
country, broadcastarea, motto, language, locationcountry
owner, webcast, broadcaststationclass, programmeformat, callsignmeaning
minimumelevation
dean, country, president
foundingyear, ceo
actscore, gender, satscore
owner, webcast, sisterstation-inv, licensee, alias, programmeformat, slogan, sisterstation, homepage
owner, broadcastnetwork, webcast, city, alias, programmeformat, sisterstation, homepage
internationally, locationcity, employer-inv
country, militarybranch-inv, militarybranch, type, homepage
hometown, background, genre, genre-inv
network-inv, country, channel-inv, sharesource, locationcountry
battle, country, education-inv
dean, country, affiliation, campus, type
country, rdf-schema#seealso, garrison, militarybranch, motto, type
country, gender, motto, grades, type, teamname
network-inv, rdf-schema#seealso, channel-inv, employer-inv
country, keyperson, locationcountry, numberofemployees
nick, country, city, affiliation, name, foundingyear, type
country, language, foundingyear, grades, state, type
numberofstations, location, numberoflines, type
managertitle, chairman, ground, title
country, activeyearsstartyear, garrison, militarybranch, aircraftelectronic, type
affiliation, developer-inv, homepage
owner, service, parentcompany, industry, internationally, type, owningcompany, homepage
parentorganisation, formationyear, headquarter, homepage
broadcastnetwork, country, locationcountry, digitalchannel, analogchannel, callsignmeaning
affiliation, team-inv, motto, type, athletics, occupation-inv
state, type, region, status
colour, campustype, motto, type
headquarter, europeanparliamentgroup, europeanaffiliation, extinctionyear, mergedintoparty, internationalaffiliation
country, colour, motto, type
country, affiliation, state, athletics, school-inv
gender, district, campustype, staff, grades, state, type
formationyear, motto, type
grades, type, religion, status, teamname
keyperson, product, industry, internationally, locationcity, homepage
owner, broadcastnetwork, webcast, programmeformat, slogan, callsignmeaning
country, averageclasssize, mascot, type
keyperson, industry, locationcountry, locationcity, occupation-inv, foundationplace
designer-inv, developer-inv, industry, location
country, province, gender, city, schoolboard, language, type, status
headlabel, religiousheadlabel, gender, city, district, schoolboard, campustype, grades, state, type
colourname, colour, formationyear, name, ideology, internationalaffiliation
facultysize, numberofstudents, motto, grades, type, religion
battle, country, rdf-schema#seealso, notablecommander
keyperson, locationcountry, builder-inv
country, effectiveradiatedpower, locationcountry, formerchannel, formercallsign
iataairlinecode, icaoairlinecode, alliance, headquarter, industry
province, city, name, motto
keyperson, fate, successor, type, foundedby, locationcity, foundationplace
formerteam-inv, location, tenant-inv, coach
locationcountry, operatedby-inv, operator-inv
colour, district, state, region
keyperson, product, designer-inv, parentcompany, industry, location, type
owner, company-inv, locationcountry, owningcompany
aircraftattack, aircraftrecon, notablecommander, aircrafttransport
birthplace, background, alias
league, location, teamname
militarybranch, aircraftinterceptor, aircrafttransport
colourname, aircrafttransport
runtime
country, chancellor, province, mascot, affiliation, vicechancellor, motto, type, officialschoolcolour
parentcompany, location, type, foundedby
formationyear, headquarter, jurisdiction, location, formationdate, homepage
headlabel, country, education-inv, upperage, type, religion
country, affiliation, campus, bandmember-inv, type, athletics
division, recordlabel-inv, foundingyear
product, parentcompany, industry, internationally, manufacturer-inv
city, district, sport, agerange
averageclasssize, name
league, location, homepage
battle, aircraftfighter, motto, aircrafttrainer, aircrafttransport
network-inv, broadcastarea, slogan
gender, grades, type, sport, slogan, religion
broadcastnetwork, webcast, city, alias, programmeformat, slogan, homepage
managerclub-inv, team-inv, managertitle, chairman, tenant-inv, chairmantitle, homepage
owner, broadcastnetwork, facilityid, city, broadcastarea, alias, broadcaststationclass, programmeformat, homepage, frequency
facultysize, averageclasssize, county, grades, state, type, religion
country, province, city, affiliation, state, homepage
voltageofelectrification, numberoflines, type
country, campustype, state, coachedteam-inv
numberofundergraduatestudents, campus, sport
facultysize, country, gender, mascot, county, language, grades, type, headlabel, campustype, motto, location, state, homepage, ratio, status
headlabel, location, foundingyear, state, homepage
rdf-schema#seealso, affiliation, campus, education-inv, state, type, athletics
locationcountry, tenant-inv, locationcity
city, district, language, state, type, rival
country, affiliation, campus, education-inv, university-inv, almamater-inv, type, training-inv, athletics, employer-inv
birthplace, background, recordlabel, genre
knownfor-inv, board-inv, type
city, state, employer-inv, coachedteam-inv
country, militarybranch-inv, motto, commandstructure, march
country, classes, campustype, type
country, foundingyear, producer-inv
country, parentcompany, distributor-inv
keyperson, internationally, locationcountry, type, homepage
country, gender, religion, ratio
formationyear, headquarter, europeanparliamentgroup, ideology, europeanaffiliation, nationalaffiliation, formationdate
associatedmusicalartist-inv, hometown, associatedmusicalartist, background, recordlabel, nonfictionsubject-inv, associatedband, formerbandmember, associatedband-inv
gender, averageclasssize, schoolboard, type
division, type, locationcity, homepage
province, affiliation, university-inv, type
keyperson, knownfor-inv, foundedby, employer-inv
country, activeyearsstartyear, garrison, militarybranch, battlehonours, activeyearsendyear
internationally, predecessor, locationcity, regionserved
classes, location
publisher-inv, keyperson, product, foundingdate, industry, location, foundingyear, type
country, city, schoolcode
owner, keyperson, industry, locationcountry, foundedby, locationcity, foundationplace, owningcompany
keyperson, parentcompany, distributor-inv
country, gender, city, mascot, motto, foundingyear, state, type
gender, mascot, campustype, type, slogan
country, localauthority, specialist, county, upperage, religion
keyperson, currentstatus, location, type
broadcastnetwork, country, formerbroadcastnetwork, effectiveradiatedpower, broadcaststationclass, locationcountry, formerchannel
keyperson, locationcountry, locationcity, equity, foundationplace
city, motto, almamater-inv, state, coachedteam-inv
