battle, country, colourname, role, militarybranch, type, notablecommander, commandstructure
owner, parentcompany, industry, locationcountry, type, locationcity, owningcompany
foundingdate, name, motto, location, foundingyear
country, chancellor, city, almamater-inv, state
nick, battle, country, militarybranch, aircraftelectronic, type
currentstatus, language, locationcity
country, chancellor, province, city, affiliation, campus, almamater-inv, type
formerbroadcastnetwork, otherchannel, analogchannel
party-inv, ideology, extinctionyear, mergedintoparty, nationalaffiliation
numberofstudents, location, foundingyear
facultysize, country, education-inv
genre, parentcompany, locationcity, subsidiary
nick, country, gender, state, type
splitfromparty, internationalaffiliation
abbreviation, regionserved, status
oversight, gender, motto, grades, type, religion
battle, aircraftattack, aircraftfighter, garrison, aircraftrecon, aircraftinterceptor, aircrafttrainer, aircrafttransport
foundingdate, name, agerange
network-inv, country, channel-inv, headquarter, language, locationcountry, owningcompany, sisterstation, distributor-inv, pictureformat
currentstatus, industry, slogan
battle, country, activeyearsstartyear, motto, type, militaryunit-inv
country, teachingstaff, mascot, state, ratio, teamname
iataairlinecode, icaoairlinecode, headquarter, targetairport, industry
battle, aircraftrecon, motto, aircrafttrainer, aircrafttransport
country, gender, averageclasssize, campustype, state, type
colourname, colour, affiliation, europeanparliamentgroup, ideology, europeanaffiliation, internationalaffiliation
targetairport, name, industry
keyperson, internationally, extinctionyear, type
parentcompany, internationally, foundedby, locationcity
country, campus, state, type, college-inv
fate, internationally, location, extinctionyear, foundationplace, regionserved
postalcode, grades, status
headquarter, motto, regionserved
publisher-inv, award-inv
country, formationyear, affiliation-inv, headquarter
leader, wgs84_pos#long, formationyear, headquarter, jurisdiction, location, type
country, affiliation, motto, type, coachedteam-inv
militarybranch-inv, motto, operator-inv, type, aircrafttrainer, march, aircrafttransport
facultysize, country, offeredclasses, language, staff, grades, type, alumni, postalcode, district, campustype, motto, location, sport
keyperson, revenue, assets, location, numberofemployees, type, netincome, equity, operatingincome
product, developer-inv, parentcompany, industry, locationcountry, locationcity
country, firstairdate, location, locationcountry, formerchannel, locationcity
product, parentcompany, location, extinctionyear
facultysize, country, city, chairman, staff, state, type
country, highschool-inv, state
colourname, role, mascot, militarybranch, motto, type, identificationsymbol
country, testaverage, county, campustype, state, type
country, colourname, role, garrison, militarybranch, type, identificationsymbol, battlehonours
country, formerbroadcastnetwork, effectiveradiatedpower, location, locationcountry, formerchannel, digitalchannel, locationcity
operator-inv, owner-inv, foundationplace
leader, wgs84_pos#long, headquarter, jurisdiction, name, location, wgs84_pos#lat, point, homepage
affiliation, almamater-inv, type, training-inv, athletics, school-inv, coachedteam-inv
publisher-inv, city, institution-inv, almamater-inv, state
foundingdate, affiliation, authority, motto, location, foundingyear
broadcastnetwork, country, formerbroadcastnetwork, effectiveradiatedpower, location, locationcountry, formerchannel, digitalchannel
country, colourname, colour, formationyear, extinctiondate, ideology, extinctionyear, mergedintoparty
keyperson, industry, location, manufacturer-inv
type, foundationplace, homepage, regionserved
party-inv, owl#differentfrom
owner, broadcastnetwork, licensee, alias, language, programmeformat, homepage
country, colour, language
city, campus, training-inv, occupation-inv
country, ranking, type
ceeb, city, state
numberoflocations, parentcompany, industry, location, type
keyperson, product, rdf-schema#seealso, industry, internationally
facultysize, city, postalcode, district, county, state, type, ratio
knownfor-inv, locationcountry, rdf-schema#seealso-inv, foundedby, locationcity, regionserved
broadcastnetwork, shareofaudience, sharesource, programmeformat
gender, specialist, upperage, type, status
product, numberoflocations, parentcompany, industry, locationcountry, locationcity
name, numberofmembers, politicalpartyinlegislature, location, house, homepage
aircraftattack, activeyearsstartyear, militarybranch, militaryunitsize
owner, company-inv, industry, locationcity, owningcompany
headlabel, country, name, upperage, type, religion
bandmember, associatedmusicalartist-inv, hometown, occupation, background, genre, associatedband-inv
headlabel, country, province, authority, language, almamater-inv, type, agerange
league, name, team-inv, chairman, ground, formationdate, capacity
country, province, gender, city, language, type, religion, agerange, denomination
publisher-inv, fate, location
country, founder, homepage
country, distributingcompany, genre, distributinglabel, location, foundingyear
owner, developer-inv, parentcompany, industry, locationcountry, type, owningcompany
product, parentcompany, industry, location, type, regionserved
battle, militarybranch-inv, type, identificationsymbol
foundingdate, numberoflocations, name, parentcompany, industry, locationcountry, foundingyear, type, foundedby, locationcity, foundationplace
birthplace, background, activeyearsendyear
keyperson, assetundermanagement, numberoflocations, name, industry, foundingyear, type, locationcity, homepage
headlabel, foundingyear, state, teamname
ucicode, tenant-inv
owner, broadcastnetwork, webcast, broadcastarea, alias, programmeformat, sisterstation, homepage
formerbroadcastnetwork, effectiveradiatedpower, broadcaststationclass, formerchannel, digitalchannel
sisterstation-inv, licensee, slogan, employer-inv, sisterstation
country, district, schoolboard, grades, state, type
country, aircraftfighter, mascot
producer-inv, manufacturer-inv, employer-inv
country, affiliation, bandmember-inv, education-inv, almamater-inv, type, athletics, coachedteam-inv
owner, name, internationally, location, type, owningcompany, homepage
owner, parentcompany, locationcity, owningcompany, homepage
numberofstudents, country, colour, type
keyperson, parentcompany, industry, locationcountry, type, foundedby
country, campustype, foundingyear, state, type, status
country, activeyearsstartyear, mascot, motto, militaryunitsize, activeyearsendyear, notablecommander
ideology, owl#differentfrom-inv, owl#differentfrom
associatedmusicalartist-inv, associatedmusicalartist, background, genre, musicalband-inv, associatedband, formerbandmember, associatedband-inv, musicalartist-inv
broadcastnetwork, country, formerbroadcastnetwork, location, locationcountry, formerchannel, employer-inv, callsignmeaning
network-inv, country, rdf-schema#seealso, channel-inv, headquarter, locationcountry, owningcompany
location, foundingyear, type, slogan
facultysize, mascot, type, religion
country, formerbroadcastnetwork, broadcaststationclass, locationcountry, formerchannel, digitalchannel, owningcompany
country, channel-inv, firstairdate, locationcountry
keyperson, product, successor, extinctiondate, industry, location, extinctionyear, foundingyear, type, homepage
battle, country, owl#differentfrom-inv, motto, activeyearsendyear
country, commander, role, aircraftfighter, activeyearsstartyear, secondcommander, militarybranch, identificationsymbol, commandstructure
foundingdate, service, industry, operatedby-inv, foundingyear, operator-inv, predecessor, type, homepage
facultysize, authority, type, ratio
developer-inv, industry, owner-inv
headquarter, language, location, homepage
grades, state, type, sport, religion
affiliation, campus, institution-inv, type, athletics, coachedteam-inv
formationyear, headquarter, name, homepage, regionserved
broadcastnetwork, company-inv, formerbroadcastnetwork, formerchannel
headlabel, country, religiousheadlabel, gender, city, district, campustype, grades, state, type
numberofstudents, numberofpostgraduatestudents, numberofdoctoralstudents, type
country, city, foundingyear, state, type, religion
country, revenue
numberofstudents, classes, type, ratio
city, county, grades, state, type, slogan
publisher-inv, developer-inv, industry, locationcountry, foundingyear
affiliation, education-inv, almamater-inv, type, athletics, officialschoolcolour
country, affiliation, education-inv, almamater-inv, state, type, athletics, employer-inv, coachedteam-inv
numberofstudents, country, motto, lowerage, staff, upperage
rector, affiliation
network-inv, location-inv
nick, battle, country, role, garrison, militarybranch, motto, type, commandstructure
owner, keyperson, type, foundedby, locationcity, foundationplace, owningcompany
network-inv, country, owl#differentfrom-inv, locationcountry, owningcompany
headlabel, district, county, state, rival, homepage, ratio, teamname
country, city, campustype, motto, grades, sport, agerange
publisher-inv, developer-inv, industry, type, distributor-inv
product, industry, location, owner-inv, foundationplace
licensee, formerbroadcastnetwork, alias, formerchannel, digitalchannel, owningcompany, homepage
numberofstudents, gender, averageclasssize, grades, type, ratio, teamname
broadcastnetwork, formerbroadcastnetwork, broadcaststationclass, formerchannel, slogan
enginetype-inv, industry, type
country, mascot, foundingyear, type, slogan, status
owner, city, broadcastarea, sharedate, sharesource, programmeformat, sisterstation
country, activeyearsstartyear, secondcommander, notablecommander
effectiveradiatedpower, formationdate, digitalchannel
country, oversight, city, foundingyear, state, type
country, formername, city, type
country, motto, state, agerange
managertitle, ground, formationdate, chairmantitle
creator-inv, industry, promotion-inv, type
influenced-inv, country, knownfor-inv
country, religioushead, upperage, type
country, splitfromparty, formationyear, headquarter, ideology, extinctionyear, mergedintoparty
lastelectiondate, name, location
product, industry, predecessor, type, homepage
owner, licensee, city, alias, broadcaststationclass, programmeformat, slogan
colourname, splitfromparty, colour, europeanparliamentgroup
numberoflocations, parentcompany, industry, type, homepage
country, address, city, name, motto, foundingyear, state, type
nick, battle, country, militarybranch, militaryunit-inv, notablecommander, commandstructure
ispartof, location, type
name, position, team, currentmember
averageclasssize, language, type, status
numberofstudents, numberofpostgraduatestudents, country, numberofundergraduatestudents, city, motto, endowment, state, officialschoolcolour
associatedmusicalartist-inv, hometown, background, bandmember-inv, associatedband-inv
targetairport, destination, industry
owl#differentfrom, occupation-inv
country, province, city, closed, type
battle, aircraftfighter, identificationsymbol, aircrafttrainer, aircrafttransport
country, averageclasssize, grades, type, religion, teamname
nick, manager, team-inv, managertitle, ground, chairmantitle
party-inv, occupation-inv
country, gender, city, postalcode, district, campustype, grades, state, type
teachingstaff, state, slogan, ratio
publisher-inv, developer-inv, industry, internationally
numberofpostgraduatestudents, country, campus, staff, type
keyperson, recordlabel-inv, location, homepage, distributor-inv
icaoairlinecode, headquarter, name, industry
country, affiliation, motto, almamater-inv, type, employer-inv
country, name, motto, type, denomination
facultysize, grades, state, type, religion, teamname
country, motto, aircrafthelicopter
bandmember, writer-inv, genre
language, currency
product, voice-inv
location, type, house
product, producer-inv
owner, knownfor-inv, tenant-inv
foundingyear, state, agerange, status
facultysize, numberofstudents, location, type, ratio
service-inv, regionserved
aircraftattack, commander, secondcommander, aircrafttransport
product, rdf-schema#seealso, industry, owner-inv
nick, country, province, city, affiliation
fate, developer-inv, foundingyear
starring-inv, associatedmusicalartist-inv, hometown, activeyearsstartyear, background, genre, associatedband-inv
owner, parentcompany, location, type, foundationplace, owningcompany, distributor-inv
facultysize, country, numberofundergraduatestudents, city, mascot, campus, type, numberofstudents, nick, name, motto, endowment, state, athletics, officialschoolcolour, homepage, president
associatedmusicalartist-inv, hometown, background, genre, rdf-schema#seealso-inv, formerbandmember, associatedband-inv
keyperson, service, industry, internationally, locationcountry, type, locationcity, regionserved
country, heightaboveaverageterrain, facilityid, effectiveradiatedpower, alias, location, locationcountry, locationcity, slogan, owningcompany, sisterstation, homepage
country, campus, vicechancellor, state
fate, operator-inv
party-inv, country, colour, headquarter, ideology, religion
product, parentcompany, extinctionyear, type
country, militarybranch-inv, commander, garrison, identificationsymbol, commandstructure
network-inv, country, sisterstation-inv, broadcastarea, formerbroadcastnetwork-inv, locationcountry, type, owningcompany
oversight, postalcode, campustype, state, type, religion
keyperson, service, internationally, employer-inv
colour, campustype, upperage, type
city, grades, state, type, rival
country, affiliation-inv, campus, state
product, knownfor-inv, industry, type, foundedby, homepage
owner, webcast, city, broadcastarea, alias, broadcaststationclass, programmeformat, slogan, sisterstation, homepage
dean, country, city, campus, type
headlabel, motto, grades, type, religion
network-inv, presenter-inv
industry, internationally, locationcity, manufacturer-inv
revenue, locationcountry, foundingyear, type, netincome, locationcity, operatingincome
keyperson, product, name, industry, foundedby, locationcity, homepage
facultysize, averageclasssize, foundingyear, status
product, knownfor-inv, industry, type, foundedby, foundationplace
country, militarybranch-inv, militarybranch, march
product, successor, industry, locationcountry
country, award-inv, league-inv, motto, foundingyear, homepage
headlabel, country, upperage, type, sport, status
owner, owningcompany, subsidiary, distributor-inv
headlabel, country, gender, city, county, motto, lowerage, upperage, type, religion
campussize, foundingyear
country, city, almamater-inv, state, athletics, employer-inv
purpose, affiliation, numberofstaff, status
nick, battle, militarybranch, identificationsymbol, notablecommander
name, type, slogan, denomination
nick, rdf-schema#seealso, ground, homepage
country, chancellor, city, affiliation, state, type, president
schoolnumber, address
owner, product, parentcompany, industry, numberofemployees, owningcompany
activeyearsstartyear, militarybranch, activeyearsendyear, commandstructure, aircraftpatrol
internationally, subsidiary, regionserved
product, service, industry, internationally, locationcountry
owner, broadcastnetwork, webcast, licensee, city, broadcastarea, broadcaststationclass, programmeformat, homepage
affiliation, education-inv, almamater-inv, state, tenant-inv, athletics, college-inv
nick, battle, country, colour, garrison, militarybranch, motto, commandstructure
county, schoolboard, language, state
country, garrison, militarybranch, aircrafttrainer
parentorganisation, motto, language, type
city, motto, grades, state, type, slogan, religion
associatedmusicalartist-inv, hometown, background, recordlabel, genre, alias, associatedband-inv
staff, type, athletics
facultysize, grades, type, religion, status
nick, battle, country, aircraftattack, colour, role, aircraftfighter, activeyearsstartyear, militarybranch, activeyearsendyear, commandstructure
country, affiliation, almamater-inv, type, academicadvisor-inv
keyperson, product, parentcompany, industry, owner-inv, type
colourname, leader, colour, headquarter, europeanaffiliation, internationalaffiliation
headlabel, country, localauthority, city, county, lowerage, upperage, type, religion
country, role, activeyearsstartyear, garrison, type, identificationsymbol, activeyearsendyear
broadcastnetwork, licensee, formerbroadcastnetwork, analogchannel, owningcompany, homepage
numberofundergraduatestudents, ispartof, location
country, gender, motto, state, type, denomination
keyperson, numberoflocations, type, regionserved
country, city, affiliation, campus, state, sport
broadcastnetwork, country, formerbroadcastnetwork, firstairdate, locationcountry, formerchannel
facultysize, averageclasssize, motto
nick, battle, militarybranch, type, militaryunit-inv, notablecommander
network-inv, broadcastnetwork, channel-inv, shareofaudience, sharesource, language, slogan, distributor-inv, pictureformat
country, formerbroadcastnetwork, effectiveradiatedpower, locationcountry, formerchannel, digitalchannel, callsignmeaning
keyperson, product, genre, industry, foundingyear, type, foundationplace
owner, foundingdate, service, industry, operatedby-inv, foundingyear, operator-inv, predecessor, type, owningcompany
country, rdf-schema#seealso, gender, city, upperage, type
country, colour, slogan
managerclub-inv, almamater-inv, tenant-inv
activeyearsstartyear, knownfor-inv, background, recordlabel, genre
nick, battle, country, role, activeyearsstartyear, garrison, militarybranch, militaryunitsize
genre, industry, locationcity, foundationplace
currentseason, tenant-inv
broadcastnetwork, country, licensee, formerbroadcastnetwork, alias, locationcountry, formerchannel, slogan, owningcompany, homepage
background, recordlabel, influencedby-inv
influenced-inv, background
country, role, militarybranch, motto, militaryunitsize, commandstructure, march
city, mascot, campustype, grades, state, type, teamname
garrison, militarybranch, commandstructure, aircraftbomber
country, location, locationcountry, formerchannel, owl#differentfrom, sisterstation
division, developer-inv, industry, type
almamater-inv, state, type, owl#differentfrom, coachedteam-inv
service, industry, internationally, locationcity, homepage
battle, militarybranch-inv, commander-inv, type, militaryunit-inv
province, postalcode, district, authority, county, grades, type, region
numberofstudents, country, province, city, campus, almamater-inv, type
sisterstation-inv, city, alias, broadcaststationclass, slogan, sisterstation
digitalsubchannel, country, location, locationcountry, formerchannel, locationcity, callsignmeaning
owner, parentcompany, industry, locationcountry, foundedby, owningcompany
nick, managertitle, chairman, ground, dissolved, homepage, capacity
frequentlyupdated, programminglanguage
city, name, broadcaststationclass, programmeformat, sisterstation
battle, country, activeyearsstartyear, militarybranch, aircrafthelicopter, type, homepage
campustype, budget
country, leader, otherparty-inv, extinctionyear
broadcastnetwork, city, broadcaststationclass, programmeformat, callsignmeaning
owner, type, locationcity, owningcompany, homepage, distributor-inv
parentcompany, industry, location, foundedby
shareofaudience, broadcastarea, sharesource, broadcaststationclass
keyperson, currentstatus, slogan
product, industry, manufacturer-inv, homepage
country, gender, city, name, campustype, grades, state, type
head, country, localauthority, county, lowerage, upperage, type
country, headquarter, ideology, nationalaffiliation, internationalaffiliation
legislativeperiodname, lastelectiondate, leader, numberofmembers, politicalpartyofleader, location, electiondateleader, homepage
rdf-schema#seealso, relative-inv, university-inv, almamater-inv
country, foundingdate, city, county, foundingyear
head, country, mascot, name, type
headlabel, country, gender, city, postalcode, county, motto, foundingyear, foundedby
country, chancellor, city, affiliation, motto, university-inv, almamater-inv, type
keyperson, product, industry, internationally, numberofemployees, type, regionserved
battle, country, colourname, colour, patron, activeyearsstartyear, garrison, motto, activeyearsendyear, notablecommander
product, industry, internationally, subsidiary
rdf-schema#seealso, state, athletics, officialschoolcolour
aircraftfighter, aircrafthelicoptertransport, aircrafttrainer, aircrafttransport, aircrafthelicopterattack
colourname, militaryunitsize, activeyearsendyear, commandstructure, march
mascot, district, campustype, motto, type, homepage
service, industry, foundingyear, type, locationcity
owner, webcast, licensee, broadcastarea, alias, broadcaststationclass, programmeformat, sisterstation, homepage
country, affiliation, education-inv, almamater-inv, state, type, training-inv, athletics
country, role, garrison, name, type, commandstructure
owner, division, parentcompany, location, owningcompany
country, activeyearsstartyear, owl#differentfrom, commandstructure
country, numberofdoctoralstudents, campus, type
country, city, affiliation, schoolboard, motto, language, foundingyear, state
formationyear, affiliation, name, motto, location, abbreviation, homepage
product, numberoflocations, industry, locationcountry, type, regionserved
associatedmusicalartist-inv, background, genre, formerbandmember, associatedband-inv, occupation-inv
facultysize, city, mascot, affiliation, motto, type, officialschoolcolour
webcast, licensee, city, broadcastarea, alias, broadcaststationclass, programmeformat, slogan, sisterstation, homepage
country, mascot, motto, foundingyear, grades, type, slogan, religion
broadcastnetwork, sharesource, broadcaststationclass, programmeformat, frequency
country, formerbroadcastnetwork, effectiveradiatedpower, alias, broadcaststationclass, locationcountry, formerchannel, slogan, owningcompany, sisterstation
broadcastrepeater, broadcaststationclass
country, province, city, language, almamater-inv, type, religion, denomination
city, broadcaststationclass, language, frequency
averageclasssize, motto, type, status
instrument-inv, locationcountry, type, locationcity
campustype, motto, foundingyear, grades, state, type, teamname
rdf-schema#seealso, formerteam-inv, team-inv, owner-inv, tenant-inv
internationally, location, type, foundedby, homepage
owner, service, owningcompany, homepage, regionserved
country, city, mascot, county, foundingyear, state, type
broadcastnetwork, lastairdate, name, callsign, alias, slogan, owningcompany, callsignmeaning
keyperson, language, industry, location, foundationplace
activeyearsstartyear, mascot, motto, militaryunitsize, type, identificationsymbol, activeyearsendyear
campustype, state, type, agerange, status
battle, role, activeyearsstartyear, militarybranch, militaryunitsize, type, identificationsymbol, activeyearsendyear, commandstructure
country, foundingyear, state, type, denomination
keyperson, fate, locationcountry, type, regionserved
internationally, employer-inv, homepage
sisterstation-inv, occupation-inv, owningcompany
country, city, district, offeredclasses, schoolboard, campustype, motto, location, state, type, status
party-inv, country, colourname, colour, headquarter, europeanparliamentgroup, ideology, europeanaffiliation
country, gender, state, type, coachedteam-inv
country, education-inv, type, ratio
product, industry, locationcountry, type, locationcity, manufacturer-inv
city, broadcastarea, firstairdate, effectiveradiatedpower
headquarter, openingyear, operatedby-inv
keyperson, status
owner, parentcompany, location, foundationplace, owningcompany, homepage
service, parentcompany, industry, type, regionserved
worstdefeat, largestwin, league, chairmantitle
keyperson, product, service, locationcountry, foundingyear, type, locationcity, regionserved
broadcastnetwork, country, rdf-schema#seealso, licensee, formerbroadcastnetwork, locationcountry, formerchannel, slogan, owningcompany
battle, country, garrison, militarybranch, motto, type, militaryunit-inv, commandstructure
headlabel, country, knownfor-inv, upperage, type
country, patron, identificationsymbol
nick, battle, country, colour, aircraftfighter, activeyearsstartyear, militarybranch, motto, activeyearsendyear
nick, motto, aircrafttransport
country, affiliation, award-inv, institution-inv, almamater-inv, type, athletics
affiliation, managerclub-inv, motto, almamater-inv, type
colourname, colour, formationyear, extinctiondate, ideology, extinctionyear, internationalaffiliation
country, district, county, foundingyear, state, type
legislativeperiodname, lastelectiondate, numberofmembers, politicalpartyinlegislature, location
legalform, numberofoffices, service, type
headlabel, country, province, city, postalcode, language, almamater-inv, type, agerange
country, patron, activeyearsstartyear, activeyearsendyear, notablecommander, commandstructure
owner, broadcastnetwork, licensee, city, broadcastarea, language, programmeformat, callsignmeaning, sisterstation, homepage
battle, country, role, activeyearsstartyear, aircraftrecon, militarybranch, identificationsymbol, aircrafttrainer, commandstructure
country, licensee, formerbroadcastnetwork, locationcountry, digitalchannel, otherchannel
owner, heightaboveaverageterrain, alias, broadcaststationclass, language, programmeformat, slogan, homepage, frequency
firstairdate, sharedate, programmeformat, slogan
parentcompany, industry, internationally, location, manufacturer-inv
country, city, postalcode, location, grades, state
europeanparliamentgroup, ideology, europeanaffiliation, religion
headlabel, gender, mascot, staff, type
country, team-inv, employer-inv
product, parentcompany, industry, internationally, type, regionserved
bandmember, associatedmusicalartist-inv, composer-inv, associatedmusicalartist, background, recordlabel, associatedband, associatedband-inv
city, district, county, staff, grades, state
product, service, parentcompany, internationally, type
