numberofstudents, country, foundingyear, type, ratio
country, affiliation, state, athletics, officialschoolcolour, college-inv
colour, slogan, officialschoolcolour
gender, tuition, type
country, numberofteams, team, homepage
averageclasssize, motto, foundingyear, grades, state, type, religion
numberofstations, typeofelectrification, numberoflines
fate, successor, parentcompany, industry, locationcountry, extinctionyear, type
county, grades, state, type, rival
country, colourname, splitfromparty, formationyear, extinctiondate, extinctionyear, mergedintoparty
manager, team-inv, ground, chairmantitle, homepage
country, localauthority, gender, county, lowerage, staff, foundingyear, upperage, type
party-inv, formationyear, ideology, extinctionyear, mergedintoparty
gender, language, upperage, sport, status
keyperson, currentstatus, type, regionserved
publisher-inv, developer-inv, industry, locationcity
district, location, category, homepage
country, affiliation, campus, education-inv, motto, almamater-inv, state, type, athletics
country, education-inv, state, rival-inv
service, industry, owner-inv
locationcountry, foundedby, locationcity, builder-inv
country, rdf-schema#seealso, city, campus, education-inv, almamater-inv, state
chancellor, affiliation, type, employer-inv
nick, affiliation, managerclub-inv, athletics
owner, language-inv, licensee, broadcastarea, distributor-inv
nick, battle, country, activeyearsstartyear, militarybranch, identificationsymbol, militaryunit-inv
battle, country, colour, aircraftfighter, activeyearsstartyear, militarybranch, motto, activeyearsendyear, commandstructure
colourname, leader, formationyear, headquarter, europeanparliamentgroup, ideology, youthwing, europeanaffiliation, internationalaffiliation
country, managerclub-inv, team-inv, state, type
keyperson, product, internationally, locationcountry, board-inv
country, city, campustype, state, type, religion, status
league, team-inv, season, managertitle, ground, chairmantitle, capacity
head, country, affiliation, motto, almamater-inv, type
militarybranch-inv, occupation-inv
owner, product, industry, internationally, locationcountry, foundingyear, owningcompany
province, city, language, officialschoolcolour
battle, aircraftfighter, aircraftelectronic, aircraftinterceptor, aircrafttransport
broadcastnetwork, country, heightaboveaverageterrain, licensee, location, locationcountry, formerchannel, otherchannel, slogan, owningcompany, sisterstation, homepage
artist-inv, composer-inv, activeyearsstartyear, background
country, education-inv, location, almamater-inv, upperage
purpose, affiliation, location, status
affiliation, developer-inv, education-inv, almamater-inv, type, athletics, employer-inv
country, recordlabel-inv, knownfor-inv, parentcompany
company-inv, developer-inv, presenter-inv
owner, product, location, type, owningcompany, distributor-inv
automobileplatform-inv
nick, agerange
webcast, broadcaststationclass, programmeformat, slogan, sisterstation, homepage, frequency
associatedmusicalartist-inv, associatedmusicalartist, activeyearsstartyear, background, writer-inv, genre, associatedband, associatedband-inv
country, gender, city, postalcode, location, foundingyear, sport
country, mascot, classes, type, ratio
product, industry, location, foundingyear, owl#differentfrom
headlabel, country, viceprincipallabel, gender, campustype, grades, state, type
headlabel, colour, type
digitalsubchannel, broadcastnetwork, country, licensee, formerbroadcastnetwork, effectiveradiatedpower, locationcountry, formerchannel, digitalchannel
industry, instrument-inv, locationcountry, foundationplace
cmykcoordinateyellow
broadcastnetwork, webcast, licensee, broadcastarea, alias, programmeformat, slogan, sisterstation, homepage
parentcompany, industry, internationally, occupation-inv
foundingdate, city, vicechancellor, type, officialschoolcolour, homepage
country, mascot, campustype, religion
location, digitalchannel, locationcity, owningcompany, sisterstation
facultysize, numberofstudents, numberofpostgraduatestudents, country, city, state
broadcastarea, sharesource, broadcaststationclass, programmeformat
country, city, education-inv, state, type, officialschoolcolour, denomination
militarybranch-inv, commander, aircrafttrainer, aircrafttransport
owner, sharedate, sharesource, programmeformat, slogan, sisterstation, frequency
headlabel, country, foundingdate, address, mascot, name, motto, foundingyear, schoolcode, foundedby, homepage, teamname
league, managerclub-inv, team-inv, season, position, title, chairmantitle
country, successor, language, locationcountry
country, city, motto, foundingyear, religion
party-inv, extinctiondate, europeanparliamentgroup, otherparty-inv, ideology, europeanaffiliation, extinctionyear
language, industry, location, regionserved
city, sharesource, broadcaststationclass, frequency
country, colour, gender, schoolboard
hometown, viafid, background, genre, bnfid, individualisedgnd
headlabel, gender, city, mascot, postalcode, district, county, state, status
facultysize, numberofstudents, campustype, location
country, state, type, foundedby, denomination
formationyear, draftteam-inv, formerteam-inv
colour, headquarter, ideology, europeanaffiliation, nationalaffiliation
battle, knownfor-inv
battle, militaryunitsize, type, homepage
broadcastnetwork, licensee, city, broadcastarea, alias, programmeformat, sisterstation, homepage
nick, gender, campustype, grades, type
headlabel, country, city, classes, schoolboard, state, upperage, sport, status
manager, league, name, managertitle, ground, position, chairmantitle
keyperson, foundingyear, equity
numberofstudents, district, motto, type
affiliation, campus, almamater-inv, type, athletics, coachedteam-inv, college-inv
leader, wgs84_pos#long, headquarter, jurisdiction, location, tenant-inv, wgs84_pos#lat, point
nick, league, team-inv, ground, position
nick, league, season, managertitle, chairmantitle
owner, webcast, broadcastarea, programmeformat, homepage, frequency
owner, broadcastnetwork, licensee, city, alias, slogan, sisterstation
league, managerclub-inv, team-inv, season, ground, position, tenant-inv, chairmantitle, capacity
product, successor, extinctiondate, industry, location, extinctionyear, predecessor-inv
owner, broadcastnetwork, webcast, city, broadcastarea, broadcaststationclass, programmeformat, slogan, sisterstation, homepage
broadcastnetwork, country, location, locationcountry, formerchannel, formercallsign
country, activeyearsstartyear, garrison, type, activeyearsendyear, homepage
owner, webcast, facilityid, licensee, city, broadcastarea, broadcaststationclass, programmeformat, sisterstation, homepage
country, colour, garrison, identificationsymbol, commandstructure
product-inv, locationcountry
battle, country, aircraftattack, colour, role, militarybranch, name, aircraftbomber
parentorganisation, formationyear, successor, extinctiondate, jurisdiction, extinctionyear, type, formationdate
nick, battle, country, aircraftfighter, garrison, militarybranch, motto
ceeb, language, state, type
developer-inv, industry, type, employer-inv
division, keyperson, product
headlabel, country, wgs84_pos#long, county, wgs84_pos#lat, point, religion
colourname, colour, headquarter, ideology, extinctionyear, owl#differentfrom
city, county, grades, state, type, teamname
headlabel, address, city, postalcode, type
owner, numberoflocations, locationcountry, extinctionyear, locationcity, owningcompany
parentorganisation, purpose, language, location, type, status
nick, managerclub-inv, team-inv, chairman, chairmantitle, homepage
populationtotal
district, language, grades, state, type, sport, agerange
country, locationcountry, locationcity, foundationplace
gender, type, slogan, ratio
country, offeredclasses, schoolboard, language, status
managerclub-inv, name, stadium
location, grades, type, denomination
knownfor-inv, parentcompany, type, foundedby
numberofstudents, country, foundingyear, state, homepage, religion
rdf-schema#seealso, parentcompany
owner, numberoflocations, locationcountry, numberofemployees, owningcompany
parentcompany, location, numberofemployees, homepage
digitalsubchannel, broadcastnetwork, country, licensee, locationcountry, formerchannel, digitalchannel, slogan, owningcompany
country, militarybranch, owningorganisation-inv, owner-inv, identificationsymbol
country, distributingcompany, genre, parentcompany, distributinglabel, location, foundedby
product, parentcompany, industry, internationally, locationcountry, subsidiary-inv, type, locationcity, foundationplace
keyperson, location, foundingyear, occupation-inv
affiliation, motto, almamater-inv, state, type, athletics, college-inv
battle, role, militarybranch, motto, militaryunitsize, type, activeyearsendyear, commandstructure
country, role, mascot, garrison, militarybranch, militaryunitsize, type, commandstructure
address, city, mascot, postalcode, district, grades, state, type, teamname
country, colourname, patron, militarybranch
division, foundingyear, type
computingplatform-inv, industry
bandmember, hometown, associatedmusicalartist, activeyearsstartyear, background, recordlabel, name, genre, alias, associatedband, formerbandmember, homepage
gender, city, postalcode, state, type, religion
production, location
headlabel, chairperson, country, gender, city, county, religion
core#subject-inv
digitalsubchannel, country, heightaboveaverageterrain, alias, locationcountry, formerchannel, digitalchannel, owningcompany
publisher-inv, recordlabel-inv, parentcompany, type, foundationplace
battle, rdf-schema#seealso, militarybranch, name, type, notablecommander
country, motto, foundingyear, state, teamname
country, affiliation, bandmember-inv, managerclub-inv, almamater-inv, type, athletics, coachedteam-inv
country, patron, militaryunitsize, activeyearsendyear, notablecommander, commandstructure
associatedmusicalartist-inv, background, genre, musicalband-inv, associatedband-inv, producer-inv, musicalartist-inv
industry, location, instrument-inv, type, foundedby, foundationplace
keyperson, numberoflocations, locationcountry, numberofemployees, type
numberofstudents, district, language, location, type
publisher-inv, fate, developer-inv, industry
owner, broadcastnetwork, webcast, licensee, city, firstairdate, programmeformat, homepage
headquarter, affiliation, homepage
country, militarybranch, battlehonours, activeyearsendyear, aircrafttransport
parentorganisation, affiliation, type, status
product, foundingyear, locationcity, distributor-inv
country, affiliation, almamater-inv, type, sport
country, city, county, campustype, state, type
affiliation, county, state, region
country, occupation, recordlabel, genre
company-inv, recordlabel-inv, foundingyear
grades, type, foundedby, religion
country, city, education-inv, almamater-inv, state, athletics, owl#differentfrom
musiccomposer-inv, associatedmusicalartist-inv, hometown, associatedmusicalartist, background, recordlabel, genre, associatedband, formerbandmember, associatedband-inv, activeyearsendyear
broadcastnetwork, country, locationcountry, otherchannel, owningcompany, callsignmeaning
role, garrison, militarybranch, type, militaryunit-inv, activeyearsendyear
country, gender, affiliation, state, type, denomination
country, foundingyear, title
fees, grades, state, type
purpose, membership, type, status
hometown, background, genre, owl#differentfrom-inv
license, programminglanguage
nick, country, state, status
type, callsignmeaning
division-inv, product, parentcompany, industry, locationcountry, type, locationcity
country, managerclub-inv, type, athletics, officialschoolcolour
keyperson, currentstatus, industry, location
battle, country, colourname, role, activeyearsstartyear, militarybranch, type, identificationsymbol, commandstructure
broadcastnetwork, formationdate, owningcompany, homepage
country, motto, state, type, slogan, denomination
owner, broadcastnetwork, webcast, alias, broadcaststationclass, programmeformat, frequency
product, education-inv, industry, internationally, type, employer-inv
training-inv, athletics, officialschoolcolour, coachedteam-inv
locationcountry, foundingyear, foundationplace, homepage
owner, product, fate, successor, parentcompany, industry, location, owningcompany
product, location, type, occupation-inv, foundationplace
parentcompany, literarygenre-inv
owner, webcast, shareofaudience, broadcastarea, sharesource, programmeformat, slogan, sisterstation
motto, grades, state, sport
owner, keyperson, locationcountry, locationcity, foundationplace, owningcompany, regionserved
publisher-inv, affiliation, state, type, athletics
product, locationcountry, foundedby, homepage
country, aircraftfighter, aircraftrecon, aircrafthelicopter, aircrafttrainer, aircrafttransport, aircraftpatrol
country, foundingdate, motto, foundingyear, type, agerange, denomination
owner, webcast, broadcaststationclass, slogan, callsignmeaning
shareofaudience, sharesource, frequency
owner, city, broadcastarea, broadcaststationclass, slogan, callsignmeaning
country, campus, owl#differentfrom-inv
internationally, location, board-inv, type
nick, country, motto, foundingyear, type
county, grades, state, type, rival-inv
nick, country, identificationsymbol, aircraftbomber
battle, garrison, militarybranch, militaryunitsize, identificationsymbol, commandstructure
nick, country, militarybranch, aircrafttransport
battle, country, role, aircraftfighter, activeyearsstartyear, aircraftrecon, militarybranch, identificationsymbol, commandstructure
bandmember, associatedmusicalartist-inv, hometown, associatedmusicalartist, background, recordlabel, associatedband, formerbandmember, associatedband-inv, homepage
keyperson, name, industry, locationcountry, locationcity, regionserved
country, militarybranch, motto, identificationsymbol, militaryunit-inv
numberofpostgraduatestudents, sport
country, mascot, staff, type
genre, influencedby
rdf-schema#seealso, numberofundergraduatestudents
recordedin-inv
party-inv, formationyear, headquarter, europeanparliamentgroup, europeanaffiliation
battle, country, rdf-schema#seealso, militaryunitsize, disbanded
webcast, city, broadcastarea, language
owner, industry, extinctionyear, foundingyear, type, owningcompany
product, rdf-schema#seealso, industry, operator-inv, locationcity
gender, city, postalcode, district, county, language, grades, state, type
facultysize, country, motto, foundingyear, type
country, oversight, city, district, state, type, sport
owner, product, fate, industry, type, locationcity, owningcompany, subsidiary, keyperson, name, locationcountry, foundingyear, foundedby
country, gender, county, education-inv, lowerage, type
schoolpatron, denomination
heightaboveaverageterrain, facilityid, effectiveradiatedpower, alias, location, owningcompany, callsignmeaning
owner, programmeformat, employer-inv
hometown, occupation, writer-inv, genre, instrument, producer-inv
parentorganisation, headquarter, location, owner-inv
headquarter, motto, numberofstaff, homepage
country, occupation, genre, activeyearsendyear
keyperson, service, type, foundationplace
distributingcompany, genre, distributinglabel, location, foundingyear, foundedby, homepage
owner, webcast, sisterstation-inv, licensee, city, broadcastarea
country, authority, type, homepage
country, role, garrison, militarybranch, militaryunitsize, type, tenant-inv, commandstructure
owner, parentcompany, industry, extinctionyear, type, owningcompany
nick, country, gender, grades, state
country, province, city, endowment
keyperson, product, industry, internationally, type, occupation-inv
owner, broadcastnetwork, webcast, licensee, city, alias, programmeformat, homepage
rdf-schema#seealso, ispartof, location, numberofgraduatestudents
location, foundingyear, coach, teamname
country, localauthority, county, motto, lowerage, foundingyear, upperage, foundedby
owner, broadcastnetwork, alias, programmeformat, slogan, sisterstation, homepage
occupation, activeyearsstartyear, background, genre, producer-inv
postalcode, district, county, lowerage, state
country, localauthority, county, lowerage, upperage, foundedby, religion
classes, motto, state
country, city, type, religion, affiliation, authority, schoolboard, campustype, motto, location, state, region, sport
country, averageclasssize, offeredclasses, schoolboard, status
league, team-inv, ground, tenant-inv, dissolved, capacity
rdf-schema#seealso, formerteam-inv, team-inv, coachedteam-inv
managerclub-inv, champion-inv
city, district, motto, foundingyear, state, type
country, heightaboveaverageterrain, facilityid, licensee, effectiveradiatedpower, location, locationcountry, formercallsign, owningcompany
facultysize, numberofstudents, country, campustype, state, type
staff, grades, type, teamname
country, lowerage, state, upperage, homepage
product, service, parentcompany, industry, location, type
party-inv, rdf-schema#seealso, formationyear, formationdate
affiliation, campus, almamater-inv, type, athletics, school-inv, coachedteam-inv
country, city, postalcode, district, campustype, state, type, homepage
product, industry, equity
musiccomposer-inv, country, genre
gender, staff, foundingyear, religion
industry, extinctionyear, foundedby
keyperson, fate, location, extinctionyear, type
country, formationyear, headquarter, religion
country, distributingcompany, parentcompany, distributinglabel, location, homepage
country, oversight, averageclasssize, postalcode, county, lowerage, location, staff, upperage, agerange
party-inv, lastelectiondate, leader, location, electiondateleader
managerclub-inv, education-inv, almamater-inv, type, athletics, college-inv
ispartof-inv, owningorganisation-inv, owner-inv
formerbroadcastnetwork, broadcaststationclass, callsignmeaning
city, postalcode, district, county, campustype, state, status
country, city, type, ratio, status
headlabel, gender, mascot, foundingyear, status
facultysize, country, city, affiliation, campus, staff, state, type, officialschoolcolour
league, team-inv, season, position, homepage
starring-inv, associatedmusicalartist-inv, hometown, artist-inv, associatedmusicalartist, background, recordlabel, genre, associatedband, associatedband-inv
foundingdate, foundingyear, status
city, league, stadium
party-inv, country, headquarter, affiliation, nationalaffiliation, internationalaffiliation
squadnumber, name, team, currentmember
city, district, type, agerange
formationyear, jurisdiction, name, formationdate
nick, battle, country, role, militaryunitsize, type, activeyearsendyear, notablecommander
product, internationally, location, foundingyear, predecessor
rdf-schema#seealso, industry, operator-inv, owner-inv
country, commander, role, aircraftfighter, militarybranch, motto, identificationsymbol, commandstructure
country, affiliation, authority, campustype, motto, foundingyear, type, region, religion
country, colour, headquarter, extinctiondate, extinctionyear, mergedintoparty, nationalaffiliation
country, mascot, grades, type, religion, teamname
name, industry, internationally, locationcountry
head, country, education-inv, almamater-inv, type
keyperson, locationcountry, foundingyear, type, homepage, regionserved
rdf-schema#seealso, affiliation, almamater-inv, state, type, athletics, occupation-inv
country, distributingcompany, genre, distributinglabel, foundingyear, foundedby, homepage
headlabel, country, county, motto, staff, upperage
country, averageclasssize, district, county, language, state, type
country, colourname, garrison, militarybranch, militaryunit-inv
hometown, associatedmusicalartist, background, genre, associatedband, instrument, formerbandmember
locationcountry, locationcity, owningcompany-inv
headlabel, country, lowerage, state, upperage
country, genre, voicetype
country, affiliation, athletics, academicadvisor-inv
nick, battle, activeyearsstartyear, militarybranch, militaryunitsize, identificationsymbol, homepage
nick, country, state, type, slogan
country, alias, broadcaststationclass, location, locationcountry, formerchannel, slogan, sisterstation, homepage
hubairport, alliance, product-inv, industry
division, keyperson, service, industry, subsidiary
country, city, campus, education-inv, almamater-inv, type, training-inv
battle, country, commandstructure-inv, militarybranch, militaryunitsize, type, activeyearsendyear
foundingdate, parentcompany, industry, location, foundingyear, type
headquarter, language, location, membership, type
headquarter, openingyear, railgauge, location
province, city, teamname
country, name, currentseason, team
country, province, city, affiliation, campus, motto, type, homepage
battle, garrison, type, identificationsymbol, militaryunit-inv, notablecommander
mascot, motto, grades, type, religion, status
activeyearsstartyear, background, genre, influencedby-inv
internationally, locationcity, producer-inv
product, industry, locationcountry, owner-inv
address, location, type, homepage
country, gender, postalcode, county, lowerage, upperage, type, foundedby
country, oversight, affiliation, state
league, name, managertitle, ground, capacity
facultysize, numberofstudents, country, grades, state, type
webcast, city, alias, language, programmeformat, slogan, callsignmeaning, homepage
country, aircraftattack, militarybranch-inv, aircraftfighter, aircraftelectronic, aircrafttrainer, aircraftbomber, aircrafttransport
alliance, industry, subsidiary
hubairport, alliance, headquarter, parentcompany, industry
product, fate, industry, extinctionyear, type
owner, keyperson, parentcompany, internationally, owningcompany
address, mascot, postalcode, district, motto
mascot, affiliation, campus, name, state, type, athletics, president
battle, country, activeyearsstartyear, name, identificationsymbol, activeyearsendyear, notablecommander
country, gender, city, grades, state, type, religion
product, industry, location, extinctionyear, type, foundationplace
country, city, affiliation, postalcode, location, grades, agerange
owningorganisation-inv, location, owner-inv
superintendent, city, county, state, type, teamname
parentcompany, industry, internationally, predecessor-inv
broadcastnetwork, licensee, broadcastarea, alias, broadcaststationclass, slogan, sisterstation
headquarter, developer-inv, type
headlabel, country, localauthority, gender, county, lowerage, upperage, type, religion
product, fate, industry, locationcountry, locationcity, regionserved
country, timezone, ispartof, utcoffset
company-inv, industry, rdf-schema#seealso-inv, type
country, rdf-schema#seealso, province, city, authority, language, type, religion, denomination
managerclub-inv, team-inv, season, managertitle, title, chairmantitle
company-inv, product, parentcompany, industry, location
country, name, genre, location
extinctionyear, mergedintoparty, religion
gender, mascot, affiliation, state, status
country, foundingyear, grades, state, type, teamname
country, numberofundergraduatestudents, affiliation, type, athletics
nick, country, role, activeyearsstartyear, garrison, type, notablecommander
schoolpatron, district, location, sport
type, owl#differentfrom, officialschoolcolour
headlabel, chairperson, country, gender, city, county, lowerage, upperage, type
company-inv, locationcountry, distributor-inv
city, postalcode, campustype, state, type, homepage, agerange
numberofstudents, chairperson, country, religion
affiliation, campus, education-inv, almamater-inv, state, type, athletics, coachedteam-inv
sisterstation-inv, broadcastnetwork-inv
formationyear, regionserved, status
owner, extinctionyear, owningcompany, homepage
country, oversight, gender, city, grades, state, type
numberofpostgraduatestudents, country, numberofundergraduatestudents, city, affiliation, campus, state
broadcastnetwork, country, licensee, locationcity, owningcompany, callsignmeaning, alias, location, locationcountry, formerchannel, slogan, sisterstation, homepage
country, militarybranch, identificationsymbol, militaryunit-inv, notablecommander
broadcastnetwork, city, alias, broadcaststationclass, sisterstation
country, activeyearsstartyear, instrument
rdf-schema#seealso, grades, state, type
fate, locationcountry, predecessor, type
nick, battle, country, militarybranch, militaryunitsize, type, identificationsymbol, battlehonours, commandstructure
country, garrison, militarybranch, type, identificationsymbol, activeyearsendyear, commandstructure
country, locationcountry, foundingyear, foundationplace
keyperson, product, service, industry, type, foundedby, locationcity
company-inv, genre
facultysize, numberofpostgraduatestudents, country, numberofundergraduatestudents, city, affiliation, staff, state, type
country, formerbroadcastnetwork, name, callsign, locationcountry, formerchannel
formationyear, ideology, religion
aircraftattack, role, aircraftfighter, aircraftrecon, aircraftelectronic, aircrafttrainer
formationyear, headquarter, otherparty-inv, nationalaffiliation
country, oversight, region
keyperson, product, assets, industry, location, type
knownfor-inv, extinctionyear
language, location, slogan
nick, league, name, managertitle, ground
country, affiliation, county
country, broadcastarea, alias, locationcountry, owningcompany
country, campus, state, athletics, school-inv
affiliation-inv, owl#differentfrom
broadcaststationclass, analogchannel
digitalsubchannel, broadcastnetwork, country, broadcaststationclass, locationcountry, formerchannel, digitalchannel, slogan
legislativeperiodname, politicalpartyinlegislature, type
formerbroadcastnetwork, effectiveradiatedpower, formerchannel, locationcity, otherchannel
country, city, name, almamater-inv, state, officialschoolcolour
country, city, knownfor-inv, campus, motto, almamater-inv, state, type
knownfor-inv, formerbroadcastnetwork, formerchannel, owningcompany
country, sisterstation-inv, locationcountry, owningcompany, sisterstation, homepage, pictureformat
analogchannel, owningcompany, callsignmeaning
broadcastnetwork, city, broadcaststationclass, language, slogan
