product, service, internationally, locationcountry, foundationplace
colour, motto, state, type
fate, numberoflocations, industry, locationcountry
owner, product, parentcompany, industry, internationally, type, owningcompany
formerbroadcastnetwork, formerchannel, type
fate, industry, internationally, foundingyear
country, gender, name, county, upperage, type, religion
country, grades, state, type, religion, agerange
battle, country, activeyearsstartyear, garrison, militaryunitsize, notablecommander
openingyear, typeofelectrification, type
fate, successor, service
province, affiliation, schoolboard, motto, language, type
keyperson, numberoflocations, internationally, type
country, city, campus, motto, state, type, training-inv
award-inv, person-inv
country, name, state, type, denomination
country, publisher-inv, rdf-schema#seealso
product, industry, type, tenant-inv, locationcity
motto, membership
country, currentseason, foundingyear, formationdate
formationyear, affiliation-inv, europeanparliamentgroup, ideology, europeanaffiliation, nationalaffiliation, internationalaffiliation
country, gender, city, campustype, sport
broadcastnetwork, webcast, facilityid, broadcastarea, alias, programmeformat, sisterstation, homepage
motto, type, school-inv
owner, city, broadcastarea, slogan, callsignmeaning, sisterstation
country, city, county, campustype, foundingyear, state, slogan, religion, ratio, status
owner, locationcountry, foundingyear, type, locationcity, foundationplace, owningcompany, regionserved
broadcastnetwork, country, channel-inv, formerbroadcastnetwork, location, locationcountry, formerchannel, sisterstation
country, campustype, staff, foundingyear
country, city, affiliation, education-inv, almamater-inv, homepage
country, campus, institution-inv, almamater-inv, training-inv, athletics, coachedteam-inv
address, city, postalcode, district, language, state, type
dean, state, type
rdf-schema#seealso, industry, internationally, type
iataairlinecode, icaoairlinecode, name, industry, subsidiary
openingtheme-inv, background, recordlabel, genre
mascot, grades, state, type, religion, teamname
currentstatus, industry, location, regionserved
keyperson, product, parentcompany, industry, internationally, location, type
passengersperday, type
locationcountry, foundingyear, type, locationcity, equity, foundationplace
lastelectiondate, name, type, homepage
division, industry, locationcountry, numberofemployees, owner-inv, locationcity, regionserved
keyperson, locationcountry, extinctionyear, foundingyear, locationcity
battle, country, militarybranch-inv, garrison, operator-inv, commandstructure
illustrator-inv, type
formationyear, headquarter, language, location, type
headlabel, country, religiousheadlabel, gender, mascot, campustype, grades, state, type
country, gender, county, foundingyear, state
offeredclasses, county, language, type, officialschoolcolour, homepage
battle, country, role, aircraftfighter, activeyearsstartyear, militarybranch, identificationsymbol, militaryunit-inv, activeyearsendyear, commandstructure
manager, league, team-inv, ground, capacity
country, gender, state, slogan, status
shareofaudience, city, sharesource, broadcaststationclass
battle, country, role, activeyearsstartyear, commander-inv, militaryunitsize, activeyearsendyear, notablecommander
nick, battle, country, colour, role, militarybranch, type, commandstructure
associatedmusicalartist-inv, hometown, associatedmusicalartist, activeyearsstartyear, background, recordlabel, genre, associatedband, associatedband-inv, producer-inv
localauthority, lowerage, location
country, affiliation, campus, almamater-inv, state, type, athletics, coachedteam-inv
country, keyperson, headquarter, language, locationcountry, homepage
country, gender, language, location, state, type, region
country, activeyearsstartyear, militarybranch, identificationsymbol, activeyearsendyear, notablecommander
country, heightaboveaverageterrain, formerbroadcastnetwork, effectiveradiatedpower, broadcaststationclass, locationcountry, formerchannel, owningcompany
powertype-inv, type
teachingstaff, location, type, homepage
aircraftattack, garrison, militarybranch, notablecommander
formationyear, ideology, spokesperson
colour, gender, grades
country, commander, activeyearsstartyear, garrison, militarybranch, activeyearsendyear
numberofstudents, country, classes, type
associatedmusicalartist-inv, hometown, background, associatedband-inv, owl#differentfrom
battle, country, owl#differentfrom
owner, keyperson, locationcountry, type, locationcity, owningcompany, regionserved
battle, country, rdf-schema#seealso, garrison, militarybranch, type, commandstructure
voltageofelectrification, typeofelectrification, type
county, motto, grades, state, type, religion
country, motto, lowerage, staff, upperage, type
product, assets, industry, location, foundingyear, type
product, name, industry, internationally, type, locationcity, homepage, regionserved
battle, country, militarybranch, type, battlehonours, notablecommander
location, rdf-schema#seealso-inv
country, oversight, language, type
country, motto, state, type, athletics, coachedteam-inv
country, affiliation, education-inv, almamater-inv, type, training-inv, athletics, occupation-inv, employer-inv, coachedteam-inv
numberofstations, operatedby, type
engineer-inv, industry, location
product, industry, locationcountry, extinctionyear, type, locationcity
owner, product, industry, locationcountry, subsidiary-inv, type, locationcity, owningcompany, regionserved
nick, battle, country, colour, role, activeyearsstartyear, militarybranch, type, activeyearsendyear
country, publisher-inv, occupation-inv
headlabel, country, lowerage, almamater-inv, upperage, type
mascot, director, university, tenant-inv, homepage
bandmember, associatedmusicalartist-inv, hometown, artist-inv, associatedmusicalartist, background, recordlabel, genre, associatedband, associatedband-inv, activeyearsendyear
country, broadcastarea, firstairdate, sharesource, locationcountry, owningcompany, homepage, pictureformat
country, gender, district, county, state, type
musiccomposer-inv, bandmember, associatedmusicalartist-inv, hometown, background, associatedband-inv
headlabel, country, foundingdate, gender, lowerage, foundingyear, upperage, type
schoolpatron, authority
nick, battle, country, colour, role, activeyearsstartyear, militarybranch, motto, activeyearsendyear
battle, aircraftattack, aircraftfighter, activeyearsstartyear, militarybranch, notablecommander, commandstructure
owner, formerteam-inv, league
headlabel, country, gender, staff, upperage, religion
city, team-inv, state, type, coachedteam-inv
broadcastnetwork, city, broadcaststationclass, language, programmeformat
headlabel, country, gender, education-inv, motto, upperage, type
type, identificationsymbol, aircrafttrainer, aircrafttransport
product, railwayrollingstock-inv, industry
district, county, state, rival, slogan
owner, product, industry, internationally, owningcompany, regionserved
commander, mascot
affiliation, type, sport, coachedteam-inv
nick, battle, country, role, aircraftfighter, militarybranch, motto
alias, broadcaststationclass, location, locationcity, slogan, sisterstation, homepage
numberofstudents, country, education-inv, almamater-inv, state, type
country, role, activeyearsstartyear, garrison, militarybranch, motto, type, commandstructure
name, motto, grades, type, religion
broadcastnetwork, webcast, licensee, alias, broadcaststationclass, programmeformat, homepage, frequency
country, aircraftattack, militarybranch, militaryunitsize, notablecommander
affiliation, almamater-inv, type, religion-inv
architect-inv, locationcity
name, industry, location, type, regionserved
oversight, city, county, grades, state, type, religion
formationyear, europeanparliamentgroup, name, ideology, europeanaffiliation, internationalaffiliation
country, province, city, postalcode, upperage
numberofstudents, headlabel, country, gender, mascot, district, campustype, grades, state, type, status
team-inv, managertitle, ground, chairmantitle, homepage
country, district, location, grades, type, tenant-inv
battle, aircraftattack, activeyearsstartyear, aircraftrecon, activeyearsendyear, aircrafttrainer, aircrafttransport
parentcompany, location, homepage, distributor-inv
district, foundingyear, type, rival
product, industry, internationally, type, manufacturer-inv
owner, developer-inv, parentcompany, industry, location, extinctionyear, foundingyear, owningcompany
owner, broadcaststationclass, programmeformat, slogan, callsignmeaning
country, numberofteams, currentseason, foundingyear, homepage
country, commander, role, aircraftfighter, secondcommander, militarybranch, identificationsymbol, commandstructure, aircrafttransport
country, rdf-schema#seealso, activeyearsstartyear, recordlabel, genre
bandmember, hometown, associatedmusicalartist, activeyearsstartyear, background, recordlabel, name, genre, alias, associatedband, activeyearsendyear
company-inv, product, industry, type, operatingincome
country, campustype, motto, foundingyear, state, type
country, rdf-schema#seealso-inv, tenant-inv
headlabel, country, state, type, slogan, denomination
country, locationcountry, tenant-inv, owningcompany
rdf-schema#seealso, industry, internationally, owner-inv
keyperson, internationally, locationcountry, foundingyear, type, locationcity
headlabel, country, gender, lowerage, almamater-inv, type
headlabel, postalcode, location, state, ratio
teachingstaff, mascot, campustype
keyperson, currentstatus, language, industry, type
company-inv, internationally, locationcity
country, aircraftrecon, aircrafthelicopter, aircrafttrainer, commandstructure
facultysize, numberofstudents, ceeb, affiliation, campustype, foundingyear, state, type, sport, ratio
numberofpostgraduatestudents, country, numberofdoctoralstudents
broadcastnetwork, licensee, effectiveradiatedpower, broadcaststationclass, owningcompany
battle, country, role, commander-inv, militaryunitsize, battle-inv, activeyearsendyear, notablecommander
country, city, affiliation, education-inv, type, athletics
product, service, internationally, locationcountry, type
broadcastnetwork-inv, owningcompany
distributinglabel-inv, distributingcompany-inv, distributingcompany, parentcompany, distributinglabel
formerbroadcastnetwork, location, formationdate
headlabel, endowment, type
product, industry, location, netincome, foundationplace
headquarter, board-inv
affiliation, campus, team-inv, athletics, coachedteam-inv
country, gender, city, postalcode, district, county, state
gender, averageclasssize, grades, state, type, status
parentorganisation, leader, extinctiondate, extinctionyear, type
developer-inv, language
country, role, activeyearsstartyear, militarybranch, name, militaryunitsize, disbanded, type, activeyearsendyear
country, affiliation, campus, award-inv, almamater-inv, athletics
network-inv, associatedmusicalartist-inv, keyperson, related-inv, associatedband-inv
revenue, industry, location, type, netincome, regionserved
country, state, type, rival, religion
country, mascot, affiliation, name, motto, type, officialschoolcolour, homepage
owner, city, broadcastarea, broadcaststationclass, callsignmeaning, sisterstation, homepage
division, product, industry, type, foundationplace
broadcastnetwork, country, broadcastarea, locationcountry, owningcompany, sisterstation, pictureformat
country, wgs84_pos#long, localauthority, city, county, lowerage, type, wgs84_pos#lat, point, homepage, religion
province, city, affiliation, postalcode, schoolboard, language, type
leader, headquarter, leadername-inv, politicalpartyinlegislature-inv
battle, country, aircraftfighter, garrison, battlehonours, notablecommander
country, managerclub-inv, ratio
currentstatus, service, language, industry, regionserved
owner, broadcastnetwork, licensee, broadcastarea, alias, slogan, sisterstation
country, gender, averageclasssize, type, ratio
digitalsubchannel, formerbroadcastnetwork, effectiveradiatedpower, broadcaststationclass
publisher-inv, developer-inv, parentcompany, industry, type
owner, broadcastnetwork, webcast, licensee, broadcastarea, alias, broadcaststationclass, programmeformat, homepage
keyperson, product, industry, internationally, locationcountry, type, locationcity
bandmember, associatedmusicalartist-inv, hometown, background, genre, associatedband-inv, producer-inv
city, postalcode, county, grades, state, type, religion
country, role, militarybranch, thirdcommander, type
country, foundingdate, motto, almamater-inv, foundingyear, religion, denomination
keyperson, extinctiondate, extinctionyear, foundationplace
headquarter, europeanparliamentgroup, ideology, europeanaffiliation, nationalaffiliation, internationalaffiliation
fate, successor, predecessor-inv
campussize, country, grades, type, religion
country, colour, campustype, grades
averageclasssize, grades, type, sport
country, gender, affiliation, state, sport, status
broadcastnetwork, country, heightaboveaverageterrain, formerbroadcastnetwork, locationcountry, formerchannel, digitalchannel
numberofdoctoralstudents, sport
teachingstaff, foundingyear
industry, internationally, locationcountry, foundingyear, numberofemployees, type, locationcity, regionserved
product, parentcompany, industry, extinctionyear
keyperson, parentcompany, predecessor
battle, activeyearsstartyear, activeyearsendyear, homepage
keyperson, product, industry, internationally, location, type, foundationplace, regionserved
servingrailwayline-inv, operatedby-inv, owner-inv
campustype, grades, state, type, religion, ratio
country, rdf-schema#seealso, gender, city, county, lowerage, type
aircraftattack, aircraftfighter, aircrafttransport, aircrafthelicopterattack
numberofstudents, country, city, district, county, state, type
numberofstudents, country, mascot, county, state, type, homepage
location, officialschoolcolour, homepage
facultysize, nick, country, averageclasssize, foundingyear, grades, state, type, religion
nick, name, managertitle, chairman, ground, chairmantitle, homepage, capacity
facultysize, motto, language, foundingyear, grades, type, ratio
owner, heightaboveaverageterrain, city, broadcastarea, broadcaststationclass, programmeformat, sisterstation
service, industry, locationcountry, type, foundationplace
country, sport, slogan, status
legislativeperiodname, leadername-inv, house
headlabel, country, gender, city, language, sport, status
hometown, activeyearsstartyear, background, genre, formerbandmember, producer-inv
county, foundingyear, grades, state, type, status
associatedmusicalartist-inv, hometown, knownfor-inv, background, formerbandmember, associatedband-inv
schoolpatron, gender, grades
service, industry, internationally, locationcountry, foundingyear, locationcity
rdf-schema#seealso, background, name
country, formerbroadcastnetwork, locationcountry, formerchannel, otherchannel, slogan, owningcompany, callsignmeaning
country, headquarter, otherparty-inv, europeanaffiliation-inv, ideology, europeanaffiliation
numberofstudents, country, campustype, motto, state, status
industry, extinctionyear, type, regionserved
digitalsubchannel, broadcastnetwork, location, callsignmeaning
country, aircraftattack, militarybranch, identificationsymbol, aircrafttransport
channel-inv, licensee, formerbroadcastnetwork, formerchannel, slogan, owningcompany
iataairlinecode, revenue, hubairport, assets, headquarter, industry, numberofemployees, formationdate
recordlabel-inv, type, distributor-inv
country, aircraftattack, militarybranch-inv, aircraftfighter, identificationsymbol, aircrafttransport
battle, country, colourname, role, activeyearsstartyear, militarybranch, type, identificationsymbol, activeyearsendyear
headlabel, chairperson, country, gender, city, lowerage, upperage, religion
activeyearsstartyear, commander-inv, militarybranch, rdf-schema#seealso-inv, commandstructure
background, subsequentwork-inv
country, averageclasssize, motto, agerange
colour, militaryunitsize
country, affiliation, type, agerange
numberofstudents, language, upperage
keyperson, internationally, locationcountry, locationcity, homepage
owner, webcast, broadcaststationclass, language, programmeformat
artist-inv, activeyearsstartyear, background, genre, producer-inv
fate, locationcountry, manufacturer-inv
rdf-schema#seealso-inv, foundingyear, type
country, secretarygeneral, leader, formationyear, headquarter, name, ideology, formationdate, homepage
associatedmusicalartist-inv, hometown, associatedmusicalartist, activeyearsstartyear, background, recordlabel, genre, associatedband, formerbandmember, associatedband-inv, activeyearsendyear, homepage
city, district, state, region
name, language, state, type, homepage
name, numberofmembers, type
product, numberoflocations, type, locationcity, foundationplace, regionserved
headlabel, city, postalcode, schoolboard, state, status
openingyear, location, homepage
schoolpatron, county, grades, state, type, religion
broadcastnetwork, licensee, city, broadcastarea, broadcaststationclass, callsignmeaning, sisterstation
country, location, staff, foundingyear
broadcaststationclass, language, slogan, sisterstation
associatedmusicalartist-inv, hometown, background, recordlabel, owl#differentfrom-inv, associatedband-inv
broadcastnetwork, webcast, facilityid, alias, broadcaststationclass, programmeformat, slogan, sisterstation, homepage
keyperson, internationally, type, equity
formationyear, headquarter, mergedintoparty, nationalaffiliation
broadcastnetwork, country, heightaboveaverageterrain, sisterstation-inv, licensee, formerbroadcastnetwork, effectiveradiatedpower, location, locationcountry, formerchannel, owningcompany, sisterstation
country, fate, locationcountry, homepage
company-inv, director-inv
name, campustype, type, religion
facultysize, owl#differentfrom
formationyear, affiliation, ideology, youthwing, nationalaffiliation
service, internationally, homepage, regionserved
country, formerbroadcastnetwork, location, locationcountry, formerchannel, occupation-inv
country, motto, language, locationcountry, pictureformat
country, agerange, ratio
country, heightaboveaverageterrain, facilityid, licensee, effectiveradiatedpower, alias, location, locationcountry, formerchannel, owningcompany, sisterstation, homepage
country, city, district, state, agerange
battle, activeyearsstartyear, garrison, militarybranch, motto, militaryunit-inv
country, grades, type, coachedteam-inv
country, colourname, commandstructure-inv, militarybranch, motto, march
product, knownfor-inv, industry, locationcountry, locationcity, regionserved
owner, webcast, licensee, city, broadcastarea, alias, broadcaststationclass, slogan, sisterstation
country, schoolboard, staff
numberofstudents, language, sport
country, gender, city, district, campustype, foundingyear, grades, state, type
owner, powertype-inv, owningcompany
industry, type, foundationplace, employer-inv
numberofstudents, denomination
country, wgs84_pos#long, gender, city, county, type, point, numberofstudents, headlabel, localauthority, closingyear, specialist, postalcode, name, motto, lowerage, foundingyear, upperage, officialschoolcolour, wgs84_pos#lat, closingdate, homepage
numberofstudents, averageclasssize, location, type
publisher-inv, industry, extinctionyear, type
country, recordlabel-inv, distributingcompany, genre, parentcompany, distributinglabel, location
nick, battle, country, role, aircraftfighter, activeyearsstartyear, militarybranch, battle-inv, activeyearsendyear
country, gender, county, state, type, religion
gender, city, language, foundingyear, type, sport
country, affiliation, almamater-inv, athletics, school-inv, coachedteam-inv
extinctiondate, service, name, industry, locationcountry, extinctionyear, foundingyear
headlabel, country, province, city, authority, language, foundingyear, type, agerange
country, recordlabel-inv, distributingcompany, genre, parentcompany, distributinglabel, foundingyear
country, garrison, identificationsymbol, march
country, managerclub-inv, state, type, athletics, coachedteam-inv
province, city, affiliation, schoolboard, motto, type
aircraftattack, aircraftfighter, aircraftrecon, identificationsymbol, aircrafttrainer, aircrafttransport
headlabel, religiousheadlabel, gender, district, foundingyear, grades, state, type
country, affiliation, campus, institution-inv, state, type, athletics
nick, country, city, education-inv, state
chairperson, localauthority, lowerage, type, religion
owner, keyperson, industry, locationcountry, foundingyear, locationcity, owningcompany, regionserved
owner, webcast, sisterstation-inv, city, broadcastarea, broadcaststationclass, sisterstation
country, city, postalcode, campustype, state, type, religion
battle, country, activeyearsstartyear, militaryunitsize, type, militaryunit-inv, activeyearsendyear, notablecommander, commandstructure
state, athletics, champion-inv
numberofstudents, country, affiliation, staff, type
headlabel, averageclasssize, classes, county, schoolboard, type, status
service, operatedby-inv, operator-inv, regionserved
country, splitfromparty, colour, formationyear, headquarter, ideology, nationalaffiliation
country, knownfor-inv, type, athletics
headquarter, award-inv
industry, instrument-inv, foundingyear, type
colour, language, status
sharesource, language, programmeformat
keyperson, product, locationcountry, predecessor, type
bandmember, associatedmusicalartist-inv, hometown, artist-inv, associatedmusicalartist, background, recordlabel, genre, associatedband, formerbandmember, associatedband-inv
broadcastnetwork, country, formerbroadcastnetwork, location, locationcountry, formerchannel, digitalchannel, locationcity
headlabel, location, agerange
keyperson, locationcountry, foundingyear, predecessor, type
league, team-inv, season, chairman, ground, position
company-inv, executiveproducer-inv, distributor-inv
successor, extinctiondate, locationcountry, extinctionyear, type, locationcity, regionserved
country, rdf-schema#seealso, localauthority, county, lowerage, foundingyear, upperage, type
battle, country, militarybranch-inv, type, commandstructure
headlabel, country, almamater-inv, upperage, religion
country, locationcountry, foundationplace, regionserved
party-inv, colour, formationyear
country, fate, extinctionyear, homepage
relation-inv
hometown, occupation, associatedmusicalartist, background, genre, associatedband, instrument, producer-inv
country, militarybranch, name, militaryunitsize, battlehonours
country, role, garrison, name, identificationsymbol, notablecommander, commandstructure
headquarter, operatedby, regionserved
keyperson, product, name, parentcompany, industry, type, locationcity
nick, country, campustype, sport
parentcompany, internationally, locationcountry, locationcity, regionserved
battle, country, aircraftattack, aircraftfighter, name, aircraftinterceptor, aircrafttrainer, aircrafttransport
aircraftfighter, militarybranch, aircrafthelicopter, identificationsymbol, aircrafttransport
league, managerclub-inv, team-inv, season, managertitle, ground, position, tenant-inv, capacity
battle, country, militarybranch-inv, thirdcommander
digitalsubchannel, country, formerbroadcastnetwork, location, locationcountry, formerchannel, locationcity
nick, battle, country, aircraftattack, colour, role, aircraftfighter, activeyearsstartyear, militarybranch, militaryunit-inv, activeyearsendyear
battle, colour, aircraftfighter, aircraftrecon, identificationsymbol, aircrafttransport
country, publisher-inv, founder, parentcompany, foundingyear
owner, webcast, language, slogan
averageclasssize, campustype, upperage
numberofstudents, numberofpostgraduatestudents, nick, country, numberofundergraduatestudents, campus, motto, state, type, officialschoolcolour, president
battle, country, garrison, militarybranch, aircraftpatrol
county, agerange, status
product, genre, industry, type, regionserved
league, name, team-inv, managertitle
militarybranch, team-inv
province, affiliation, schoolboard, teamname
keyperson, industry, internationally, builder-inv
numberofstudents, mascot, staff, foundingyear, homepage
musiccomposer-inv, bandmember, hometown, background, genre
developer-inv, numberoflocations, industry, locationcountry, locationcity, foundationplace
publisher-inv, industry, location, employer-inv
publisher-inv, industry, internationally, locationcountry
iataairlinecode, hubairport, icaoairlinecode, parentcompany, destination, industry, homepage
headlabel, affiliation, status
city, authority, campustype, grades, state, type, religion
party-inv, formationyear, headquarter, ideology, europeanaffiliation, internationalaffiliation
owner, broadcastnetwork, alias, language, programmeformat, slogan
owner, webcast, language, sisterstation
league, managerclub-inv, team-inv, season, managertitle, position, title
country, chancellor, city, affiliation, motto, endowment, type, officialschoolcolour, homepage
gender, averageclasssize, campustype, grades, state, type
owner, product, service, type, owningcompany
rdf-schema#seealso, agerange
publisher-inv, product, industry, locationcountry, type
manager, league, managertitle, ground, chairmantitle, capacity
company-inv, product, developer-inv, parentcompany, type
motto, foundingyear, grades, state, type, status
language, officialschoolcolour, agerange
headlabel, gender, grades, type, religion
country, role, activeyearsstartyear, garrison, militarybranch, name, identificationsymbol, commandstructure
nick, battle, garrison, militarybranch, militaryunitsize, type, commandstructure
parentcompany, type, author-inv
affiliation, motto, teamname
formationyear, name, homepage, status
product, numberoflocations, industry, internationally, locationcountry, numberofemployees
product, owner-inv, type, owningcompany-inv
country, province, gender, location, foundedby
service, industry, foundedby, locationcity, regionserved
sisterstation-inv, licensee, broadcastarea, broadcaststationclass, programmeformat, sisterstation
